{
  "schema_version": "1.0",
  "tasks": [
    {
      "commands": ["V5 resolver preflight and frozen interval-evidence definition check"],
      "expected_artifact": "regime-moe-lab/artifacts/g1-v2-development-integration-insufficiency.json",
      "id": "g1-v2-development-only-integration-sample",
      "last_checkpoint": {"artifact_exists": true, "at_utc": "2026-08-12T15:20:00Z", "commands": ["V5 resolver preflight and frozen interval-evidence definition check"], "deterministic_validation": ["exact resolver validated without data open", "frozen protocol lacks calculation and tie-break definitions", "zero data and holdout access"], "expected_artifact": "regime-moe-lab/artifacts/g1-v2-development-integration-insufficiency.json", "model_role": "deterministic_evidence", "model_route": {"availability": "NOT_INVOKED", "model": "gpt-5.6-luna", "reasoning": "medium"}, "source_commit_or_blocker": "G1_V2_INTERVAL_SELECTION_EVIDENCE_INSUFFICIENT", "status": "HUMAN_APPROVAL", "task_id": "g1-v2-development-only-integration-sample", "validation_result": "G1_V2_INTERVAL_SELECTION_EVIDENCE_INSUFFICIENT", "workstream": "DATA_AND_EVALUATION"},
      "priority": 21,
      "role": "deterministic_evidence",
      "state": "HUMAN_APPROVAL",
      "validation": ["exact frozen interval evidence", "zero data before selection protocol is executable", "zero holdout access"],
      "workstream": "DATA_AND_EVALUATION"
    },
    {
      "commands": ["provision locked local environment and run synthetic G1 v2 validation"],
      "dependency_outcomes": {"g1-v2-frozen-protocol-conformance": "TERMINAL"},
      "depends_on": ["g1-v2-frozen-protocol-conformance"],
      "expected_artifact": "regime-moe-lab/artifacts/g1-v2-reproducible-environment-report.json",
      "id": "g1-v2-reproducible-environment-validation",
      "last_checkpoint": {"artifact_exists": true, "at_utc": "2026-08-12T15:05:00Z", "commands": ["provision locked local environment and run synthetic G1 v2 validation"], "deterministic_validation": ["47 lab tests pass", "ruff and strict mypy pass", "JSON Schema and compilation pass", "two-run reproducibility pass", "zero market-data and holdout access"], "expected_artifact": "regime-moe-lab/artifacts/g1-v2-reproducible-environment-report.json", "model_role": "deterministic_evidence", "model_route": {"availability": "NOT_INVOKED", "model": "gpt-5.6-luna", "reasoning": "medium"}, "source_commit_or_blocker": "G1_V2_FULL_VALIDATION_PASS", "status": "TERMINAL", "task_id": "g1-v2-reproducible-environment-validation", "validation_result": "G1_V2_REPRODUCIBLE_ENVIRONMENT_PASS", "workstream": "DATA_AND_EVALUATION"},
      "priority": 20,
      "role": "deterministic_evidence",
      "state": "TERMINAL",
      "validation": ["isolated environment", "complete lab validation", "no market data", "no G2 release"],
      "workstream": "DATA_AND_EVALUATION"
    },
    {
      "adapter": "supervised_g1_v2_conformance",
      "commands": ["synthetic frozen-protocol conformance only"],
      "expected_artifact": "regime-moe-lab/artifacts/g1-v2-integration-gate.json",
      "id": "g1-v2-frozen-protocol-conformance",
      "last_checkpoint": {
        "artifact_exists": true,
        "at_utc": "2026-08-12T14:39:21.793865Z",
        "commands": ["synthetic frozen-protocol conformance only"],
        "deterministic_validation": ["cross-artifact conformance PASS", "two-run reproducibility PASS", "zero market-data and holdout access", "focused Sol/high review PASS"],
        "expected_artifact": "regime-moe-lab/artifacts/g1-v2-integration-gate.json",
        "model_role": "research_director",
        "model_route": {"model": "gpt-5.6-sol", "reasoning": "high"},
        "source_commit_or_blocker": "G1_V2_PROTOCOL_CONFORMANCE_PASS",
        "status": "TERMINAL",
        "task_id": "g1-v2-frozen-protocol-conformance",
        "validation_result": "G1_V2_PROTOCOL_CONFORMANCE_PASS",
        "workstream": "DATA_AND_EVALUATION"
      },
      "priority": 19,
      "role": "research_director",
      "state": "TERMINAL",
      "validation": ["cross-artifact validator", "two-run reproducibility", "focused review PASS", "no market data", "no G2 release"],
      "workstream": "DATA_AND_EVALUATION"
    },
    {
      "adapter": "repository_state_smoke",
      "commands": [
        "git status --short --branch"
      ],
      "expected_artifact": "REGIMEMOE_SCORECARD.json",
      "id": "phase0-repository-state-smoke",
      "last_checkpoint": {
        "at_utc": "2026-08-08T20:09:06.846063Z",
        "commands": [
          "git status --short --branch"
        ],
        "deterministic_validation": [
          "read-only repository state",
          "no holdout resolution"
        ],
        "expected_artifact": "REGIMEMOE_SCORECARD.json",
        "model_role": "deterministic_evidence",
        "model_route": {
          "model": "gpt-5.6-luna",
          "reasoning": "medium"
        },
        "source_commit_or_blocker": "## main...origin/main [ahead 2]\n M orchestrate_regimemoe.py\n M regime_moe_program/REGIMEMOE_SCORECARD.json\n M regime_moe_program/REGIMEMOE_WORK_QUEUE.json\n?? regime_moe_program/.orchestrator.lock\n?? regime_moe_program/PHASE_0_ARCHITECTURE_REVIEW.md",
        "status": "TERMINAL",
        "task_id": "phase0-repository-state-smoke",
        "validation_result": "READ_ONLY_REPOSITORY_STATE_SMOKE",
        "workstream": "DATA_AND_EVALUATION"
      },
      "priority": 0,
      "role": "deterministic_evidence",
      "state": "TERMINAL",
      "validation": [
        "read-only repository state",
        "no holdout resolution"
      ],
      "workstream": "DATA_AND_EVALUATION"
    },
    {
      "blocker": "superseded by recorded G0 foundation pass",
      "commands": [
        "read-only contract review"
      ],
      "expected_artifact": "regime-moe-lab/contracts/DATA_CONTRACT.md",
      "id": "phase0-data-contract-review",
      "priority": 1,
      "role": "deterministic_evidence",
      "state": "HUMAN_APPROVAL",
      "validation": [
        "schema validation",
        "no holdout resolution"
      ],
      "workstream": "DATA_AND_EVALUATION"
    },
    {
      "blocker": "no execution adapter authorized",
      "commands": [
        "interface-only review"
      ],
      "expected_artifact": "regime-moe-lab/contracts/EXPERT_CONTRACT.md",
      "id": "phase0-expert-interface",
      "priority": 2,
      "role": "implementation_engineer",
      "state": "HUMAN_APPROVAL",
      "validation": [
        "no training",
        "no evaluation"
      ],
      "workstream": "EXPERTS_AND_BASELINES"
    },
    {
      "blocker": "no execution adapter authorized",
      "commands": [
        "bounded design review"
      ],
      "expected_artifact": "regime-moe-lab/contracts/ROUTER_CONTRACT.md",
      "id": "phase0-router-leakage",
      "priority": 3,
      "role": "research_director",
      "state": "HUMAN_APPROVAL",
      "validation": [
        "meta-leakage clauses present"
      ],
      "workstream": "AI_ROUTER"
    },
    {
      "blocker": "no execution adapter authorized",
      "commands": [
        "draft only"
      ],
      "expected_artifact": "regime-moe-lab/thesis/proposal/THESIS_CHARTER.md",
      "id": "phase0-thesis-proposal",
      "priority": 4,
      "role": "content_product",
      "state": "HUMAN_APPROVAL",
      "validation": [
        "no research claim mutation"
      ],
      "workstream": "THESIS_AND_CAREER"
    },
    {
      "blocker": "website externally locked",
      "commands": [
        "draft queue only"
      ],
      "expected_artifact": "regime-moe-lab/content/CONTENT_QUEUE.json",
      "id": "phase0-content-calendar",
      "priority": 5,
      "role": "content_product",
      "state": "HUMAN_APPROVAL",
      "validation": [
        "STORE_LIVE=false",
        "verified milestones only"
      ],
      "workstream": "AUDIENCE_AND_MONETIZATION"
    },
    {
      "commands": [
        "do not invoke timer"
      ],
      "expected_artifact": "external funding report",
      "id": "funding-finalization",
      "priority": 99,
      "role": "deterministic_evidence",
      "state": "WAITING_EXTERNAL",
      "validation": [
        "independent READY tasks continue"
      ],
      "workstream": "DATA_AND_EVALUATION"
    },
    {
      "adapter": "data_contract_validation",
      "commands": [
        "validate published development-only contracts"
      ],
      "expected_artifact": "regime-moe-lab/artifacts/g1-data-contract-validation.json",
      "id": "g1-data-contract-validation",
      "last_checkpoint": {
        "artifact_exists": true,
        "at_utc": "2026-08-09T15:51:25.835157Z",
        "commands": [
          "validate published development-only contracts"
        ],
        "deterministic_validation": [
          "development-only scope",
          "holdout remains unresolved",
          "no market-data path resolution",
          "deterministic artifact"
        ],
        "expected_artifact": "regime-moe-lab/artifacts/g1-data-contract-validation.json",
        "model_role": "deterministic_evidence",
        "model_route": {
          "availability": "NOT_INVOKED",
          "model": "gpt-5.6-luna",
          "reasoning": "medium"
        },
        "source_commit_or_blocker": "artifact_sha256=da1936b4dfda918fc0680309a63b60891bdb32f570266151cc314163ede46012",
        "status": "TERMINAL",
        "task_id": "g1-data-contract-validation",
        "validation_result": "G1_DATA_CONTRACT_VALIDATION_PASS",
        "workstream": "DATA_AND_EVALUATION"
      },
      "priority": 10,
      "role": "deterministic_evidence",
      "state": "TERMINAL",
      "validation": [
        "development-only scope",
        "holdout remains unresolved",
        "no market-data path resolution",
        "deterministic artifact"
      ],
      "workstream": "DATA_AND_EVALUATION"
    },
    {
      "adapter": "development_manifest_inventory",
      "commands": [